<?xml version="1.0" encoding="UTF-8"?>
<xs:schema xmlns:xs="http://www.w3.org/2001/XMLSchema">
  <xs:element name="inventario">
    <xs:complexType>
      <xs:sequence>
        <xs:element name="objeto" maxOccurs="unbounded">
          <xs:complexType>
            <xs:sequence>
              <xs:element name="nombre" type="xs:string"/>
              <xs:element name="cantidad" type="xs:integer"/>
              <xs:element name="categoria" type="xs:string"/>
            </xs:sequence>
          </xs:complexType>
        </xs:element>
      </xs:sequence>
    </xs:complexType>
  </xs:element>
</xs:schema>